[
  {
    "$schema": "../../schemas/education.schema.json",
    "slug": "1st-gnps-user-meeting",
    "title": "1st GNPS User Meeting",
    "summary": "External workshop recording related to gnps collected for the Navigator Education alpha.",
    "url": "https://www.youtube.com/watch?v=4HMjK4Js8xI",
    "resource_type": "workshop",
    "tool_slugs": [
      "gnps"
    ],
    "provider": "GNPS",
    "experience_level": "unspecified",
    "language": "en",
    "note": "May be broad/community rather than tutorial; assess utility.",
    "validation_status": "unreviewed",
    "provenance": {
      "submitted_by": "curator",
      "last_checked": "2026-09-26"
    },
    "status": {
      "entry": "draft"
    },
    "year": 2020,
    "year_kind": "published",
    "date_source": "https://www.youtube.com/watch?v=4HMjK4Js8xI",
    "date_verified_at": "2026-09-26"
  },
  {
    "$schema": "../../schemas/education.schema.json",
    "slug": "bioconductor-untargeted-lc-ms-preprocessing-with-xcms",
    "title": "Bioconductor untargeted LC-MS preprocessing with XCMS",
    "summary": "Detailed hands-on preprocessing workshop; older but technically useful.",
    "url": "https://www.bioconductor.org/help/course-materials/2019/CSAMA/materials/labs/lab-05-metabolomics/preprocessing-untargeted-metabolomics.html",
    "resource_type": "tutorial",
    "tool_slugs": [
      "xcms"
    ],
    "provider": "Training resource",
    "experience_level": "mixed",
    "language": "en",
    "note": "Alpha resource; manual content/currentness validation pending.",
    "validation_status": "unreviewed",
    "provenance": {
      "submitted_by": "curator",
      "last_checked": "2026-09-26"
    },
    "status": {
      "entry": "draft"
    }
  },
  {
    "$schema": "../../schemas/education.schema.json",
    "slug": "cmfi-mass-spec-seminar-10-metabolomics-data-analysis-with-pyopenms",
    "title": "CMFI Mass Spec Seminar #10 - Metabolomics Data Analysis with pyOpenMS",
    "summary": "External workshop recording related to openms collected for the Navigator Education alpha.",
    "url": "https://www.youtube.com/watch?v=XWDFZXYp1qM",
    "resource_type": "workshop",
    "tool_slugs": [
      "openms"
    ],
    "provider": "Functional Metabolomics Lab",
    "experience_level": "unspecified",
    "language": "en",
    "note": "Hands-on pyOpenMS with Binder.",
    "validation_status": "unreviewed",
    "provenance": {
      "submitted_by": "curator",
      "last_checked": "2026-09-26"
    },
    "status": {
      "entry": "draft"
    },
    "year": 2022,
    "year_kind": "published",
    "date_source": "https://www.youtube.com/watch?v=XWDFZXYp1qM",
    "date_verified_at": "2026-09-26"
  },
  {
    "$schema": "../../schemas/education.schema.json",
    "slug": "cmfi-molecular-networking-seminar",
    "title": "CMFI Molecular Networking seminar",
    "summary": "External workshop recording related to gnps, gnps-classical-molecular-networking collected for the Navigator Education alpha.",
    "url": "https://youtu.be/s5y1XNKENbk",
    "resource_type": "workshop",
    "tool_slugs": [
      "gnps",
      "gnps-classical-molecular-networking"
    ],
    "provider": "Functional Metabolomics Lab / GNPS",
    "experience_level": "unspecified",
    "language": "en",
    "note": "Molecular networking seminar by Dorrestein/Petras.",
    "validation_status": "unreviewed",
    "provenance": {
      "submitted_by": "curator",
      "last_checked": "2026-09-26"
    },
    "status": {
      "entry": "draft"
    },
    "year": 2022,
    "year_kind": "published",
    "date_source": "https://youtu.be/s5y1XNKENbk",
    "date_verified_at": "2026-09-26"
  },
  {
    "$schema": "../../schemas/education.schema.json",
    "slug": "gc-ms-deconvolution-library-search-and-molecular-networking",
    "title": "GC-MS deconvolution, library search and molecular networking",
    "summary": "External workshop recording related to gnps collected for the Navigator Education alpha.",
    "url": "https://www.youtube.com/watch?v=CXDlwC7evnk",
    "resource_type": "workshop",
    "tool_slugs": [
      "gnps"
    ],
    "provider": "GNPS",
    "experience_level": "unspecified",
    "language": "en",
    "note": "GC-MS workflow training.",
    "validation_status": "unreviewed",
    "provenance": {
      "submitted_by": "curator",
      "last_checked": "2026-09-26"
    },
    "status": {
      "entry": "draft"
    },
    "year": 2020,
    "year_kind": "published",
    "date_source": "https://www.youtube.com/watch?v=CXDlwC7evnk",
    "date_verified_at": "2026-09-26"
  },
  {
    "$schema": "../../schemas/education.schema.json",
    "slug": "gnps-classical-molecular-networking-in-portuguese",
    "title": "GNPS Classical Molecular Networking in Portuguese",
    "summary": "External workshop recording related to gnps-classical-molecular-networking collected for the Navigator Education alpha.",
    "url": "https://www.youtube.com/watch?v=Lba9e45ZAE0",
    "resource_type": "workshop",
    "tool_slugs": [
      "gnps-classical-molecular-networking"
    ],
    "provider": "GNPS community / official listing",
    "experience_level": "unspecified",
    "language": "pt",
    "note": "Portuguese-language tutorial.",
    "validation_status": "unreviewed",
    "provenance": {
      "submitted_by": "curator",
      "last_checked": "2026-09-26"
    },
    "status": {
      "entry": "draft"
    },
    "year": 2020,
    "year_kind": "published",
    "date_source": "https://www.youtube.com/watch?v=Lba9e45ZAE0",
    "date_verified_at": "2026-09-26"
  },
  {
    "$schema": "../../schemas/education.schema.json",
    "slug": "gnps-classical-molecular-networking-in-spanish",
    "title": "GNPS Classical Molecular Networking in Spanish",
    "summary": "External workshop recording related to gnps-classical-molecular-networking collected for the Navigator Education alpha.",
    "url": "https://www.youtube.com/watch?v=hTZzZI3PtR0",
    "resource_type": "workshop",
    "tool_slugs": [
      "gnps-classical-molecular-networking"
    ],
    "provider": "GNPS",
    "experience_level": "unspecified",
    "language": "es",
    "note": "Spanish-language tutorial.",
    "validation_status": "unreviewed",
    "provenance": {
      "submitted_by": "curator",
      "last_checked": "2026-09-26"
    },
    "status": {
      "entry": "draft"
    },
    "year": 2020,
    "year_kind": "published",
    "date_source": "https://www.youtube.com/watch?v=hTZzZI3PtR0",
    "date_verified_at": "2026-09-26"
  },
  {
    "$schema": "../../schemas/education.schema.json",
    "slug": "gnps-classical-molecular-networking",
    "title": "GNPS Classical Molecular Networking",
    "summary": "External workshop recording related to gnps-classical-molecular-networking, gnps collected for the Navigator Education alpha.",
    "url": "https://www.youtube.com/watch?v=PqTuex0nsGk",
    "resource_type": "workshop",
    "tool_slugs": [
      "gnps-classical-molecular-networking",
      "gnps"
    ],
    "provider": "GNPS",
    "experience_level": "unspecified",
    "language": "en",
    "note": "Strong foundational workshop.",
    "validation_status": "unreviewed",
    "provenance": {
      "submitted_by": "curator",
      "last_checked": "2026-09-26"
    },
    "status": {
      "entry": "draft"
    },
    "year": 2020,
    "year_kind": "published",
    "date_source": "https://www.youtube.com/watch?v=PqTuex0nsGk",
    "date_verified_at": "2026-09-26"
  },
  {
    "$schema": "../../schemas/education.schema.json",
    "slug": "gnps-dashboard-overview",
    "title": "GNPS Dashboard - Overview",
    "summary": "External workshop recording related to gnps-dashboard, gnps collected for the Navigator Education alpha.",
    "url": "https://www.youtube.com/watch?v=S3aAkGTMC-g",
    "resource_type": "workshop",
    "tool_slugs": [
      "gnps-dashboard",
      "gnps"
    ],
    "provider": "GNPS",
    "experience_level": "unspecified",
    "language": "en",
    "note": "Official dashboard overview.",
    "validation_status": "unreviewed",
    "provenance": {
      "submitted_by": "curator",
      "last_checked": "2026-09-26"
    },
    "status": {
      "entry": "draft"
    },
    "year": 2021,
    "year_kind": "published",
    "date_source": "https://www.youtube.com/watch?v=S3aAkGTMC-g",
    "date_verified_at": "2026-09-26"
  },
  {
    "$schema": "../../schemas/education.schema.json",
    "slug": "gnps-dashboard-teaching-tutorial-use-case",
    "title": "GNPS Dashboard teaching/tutorial use case",
    "summary": "External training video related to gnps-dashboard collected for the Navigator Education alpha.",
    "url": "https://www.youtube.com/watch?v=tT5b1IIJCE8",
    "resource_type": "video",
    "tool_slugs": [
      "gnps-dashboard"
    ],
    "provider": "GNPS",
    "experience_level": "unspecified",
    "language": "en",
    "note": "Direct tutorial video linked in Dashboard teaching docs.",
    "validation_status": "unreviewed",
    "provenance": {
      "submitted_by": "curator",
      "last_checked": "2026-09-26"
    },
    "status": {
      "entry": "draft"
    },
    "year": 2021,
    "year_kind": "published",
    "date_source": "https://www.youtube.com/watch?v=tT5b1IIJCE8",
    "date_verified_at": "2026-09-26"
  },
  {
    "$schema": "../../schemas/education.schema.json",
    "slug": "gnps-fbmn-american-gut-mzmine2-tutorial",
    "title": "GNPS FBMN - American Gut / MZmine2 tutorial",
    "summary": "External training video related to gnps-feature-based-molecular-networking, mzmine collected for the Navigator Education alpha.",
    "url": "https://www.youtube.com/watch?v=5jjMllbwD-U",
    "resource_type": "video",
    "tool_slugs": [
      "gnps-feature-based-molecular-networking",